{
  "abi": "gnu",
  "approved_operator_ids": [
    "41689e0d-82d2-4857-82af-f56d8d128c4f"
  ],
  "architecture": "x86_64",
  "designation_id": "c8349c0e-7a19-44ee-817e-4657637badbb",
  "endpoint_id": "77dad005-1930-4c68-b499-f8cd4dc058b4",
  "kind": "isolated_vm",
  "lab_inventory_reference": "/home/zer0/.local/share/jocky-v5-vms/debian-t165-checkpoint/inventory.json",
  "label": "jocky-debian-lab",
  "schema_version": "1.0.0",
  "valid_from": "2026-10-15T06:39:49Z",
  "valid_until": "2026-10-15T09:44:49Z"
}
